title,description,country,year,important,keywords,link,image
1st Amendment to the Constitution,"1860: 1st Amendment to the Constitution: Proposed by Buenos Aires to the Reform Convention, it included modifications to Article 3, which established Buenos Aires as the capital.",Argentina,1860,no,,,
Battle of Pavón,"The Battle of Pavón, a key battle of the Argentine Civil Wars, was fought in Pavón, Santa Fé Province, Argentina on 17 September 1861 between the Army of the State of Buenos Aires, commanded by Bartolomé Mitre, and the Army of Republic of the Argentine Confederation, commanded by Justo José de Urquiza. The withdrawal of Urquiza left the field to Mitre. The victory led to the dissolution of the national government and the reincorporation of Buenos Aires Province into the Argentine Republic as a dominant member of the nation. Governor Bartolomé Mitre would act as interim president, ratified by the National Congress, and then as the first president of a unified Argentine Republic.",Argentina,1861,no,,,
1861 Mendoza earthquake,"The provincial capital, Mendoza, was devastated by an earthquake, resulting in a significant loss of life estimated between 6,000 to 12,000 people, although some sources suggest even higher numbers. Additionally, thousands of individuals were injured in the disaster. The earthquake caused extensive destruction, including the collapse of buildings such as the cabildo, which served as the colonial government house. Fires, triggered by ruptured gas supply lines, continued for four days, further exacerbating the devastation. The disruption of canals led to local flooding, while liquefaction effects and numerous large landslides were widely observed. Subsequently, the town was reconstructed in a different location, and in 1863, the authorities relocated to their new seat.",Argentina,1861,no,,,
1862-1868 Presidency of Bartolomé Mitre,"In the year 1862, Bartolomé Mitre assumed the presidency of Argentina after the dissolution of the Argentine Confederation. He was elected as the President for the period 1862-1868. Mitre faced various challenges in his presidency, including opposition from provincial leaders who rejected his policies. One notable opponent was the caudillo Chacho Peñaloza from La Rioja, who rose up against the national government but was repressed by Mitre's forces. Mitre also implemented measures such as the nationalization of customs to distribute revenue among the provinces and address economic weaknesses.",Argentina,1862,no,,,
Formation and Early Years of Argentina's Supreme Court,"In 1862, Congress passed Law No. 27, establishing the Supreme Court of Argentina with five judges. However, one nominee declined the appointment, and the Court began functioning with four members. Francisco Pico served as the Attorney General of the Nation during this time. In 1863, Law No. 48 defined the jurisdiction of national courts and introduced the federal extraordinary appeal for federal issues. After a delay of ten years since the Constitution's sanction, the Supreme Court was finally installed on October 11, 1863. The Court issued its first internal regulations and rendered its first decision four days later. Jose Benjamin Gorostiaga later filled the vacancy left by the declined appointment. These early years marked the establishment of the Supreme Court and the development of its constitutional doctrine.",Argentina,1863,no,,,
Hesperidina: An Argentine Drink with Historical Significance and Medicinal Properties,"Hesperidina is a beverage originating from Argentina, created in 1864 by Melville Sewell Bagley. It is made from the rind of bitter or sour and sweet oranges with a high content of flavonoids such as hesperidin, neohesperidin, and narangin. The drink has a smooth, sweet flavor and is commonly mixed with tonic water, carbonated water, lime and lemon soda, or used in various cocktails. Hesperidina gained popularity quickly due to its original taste and quality ingredients. Bagley implemented an innovative advertising campaign that made it a fashionable aperitif, even socially accepted for consumption by women in public spaces. The drink faced imitation attempts, prompting Bagley to protect it with labels and trademarks. Hesperidina also played a role in the war of the Triple Alliance, being used to revitalize wounded soldiers. With its medicinal properties, including antioxidant effects, Hesperidina has been found to have therapeutic uses such as aiding digestion, improving circulation, reducing cholesterol and pain, and treating conditions like varicose ulcers and hemorrhoids. The drink has also made appearances in literature, tango songs, and was even carried by the explorer Francisco Pascasio Moreno on his expeditions.",Argentina,1864,no,,,
1865-1870: War with Paraguay,"The War of the Triple Alliance, or Paraguayan War (1864-1870, with Argentina and Uruguay entering the conflict in 1865), was a devastating conflict in South America. Paraguay, under President Francisco Solano López, fought against Brazil, Argentina, and Uruguay over territorial disputes and regional dominance. Despite initial success, Paraguay was eventually defeated, leading to massive loss of life, destruction, and economic ruin for the country. Brazil emerged as the dominant power, and Paraguay faced years of hardship and instability. The war's impact on the region was significant, reshaping relationships and leaving a lasting legacy of tragedy.",Argentina,1865,no,,,
Battle of Pehuajó,"The Battle of Pehuajó, also known as the Battle of Corrales, occurred on January 31, 1866, during the War of the Triple Alliance. It was the final battle on Argentine territory before the Allies launched their counterattack in Paraguay. The Paraguayan forces, despite facing disadvantages such as being outnumbered and lacking proper footwear, managed to repel the Argentine troops and inflict heavy casualties. The battle highlighted the resilience and tactical abilities of the Paraguayan army. However, it did not significantly alter the overall course of the war, and the Allies proceeded with their plans to invade Paraguayan territory.",Argentina,1866,no,,,
Cholera Outbreak Grips 1867 Argentina,"In 1867, Argentina faced a severe cholera outbreak, suspected to have been brought by returning troops from the war against Paraguay. The epidemic quickly spread across the country, affecting provinces such as Corrientes, Entre Ríos, Santa Fe, Córdoba, and Buenos Aires. The unsanitary conditions in Buenos Aires, characterized by pestilence from salting and slaughterhouses, muddy streets, and contaminated water, contributed to the disease's rapid transmission. Although the exact death toll remains uncertain, an estimated 8,920 lives were lost in Buenos Aires alone. With limited understanding of cholera's cause, varying beliefs attributed it to the climate, environment, or the effectiveness of quarantine measures to contain its spread. This lack of consensus resulted in diverse approaches to combat the devastating epidemic.",Argentina,1867,no,,,
1868 - 1874: Presidency of Domingo Faustino Sarmiento,"Domingo Faustino Sarmiento, an Argentine activist, intellectual, writer, and statesman, left a lasting impact on his country as the second President of Argentina. Belonging to the influential Generation of 1837, Sarmiento's wide-ranging writings covered diverse subjects such as journalism, autobiography, political philosophy, and history. Growing up in a politically active yet impoverished family, he faced periods of exile between 1843 and 1850, during which he penned his acclaimed work, ""Facundo,"" a scathing critique of the dictatorship of Juan Manuel de Rosas. Sarmiento's dedication to combating authoritarian regimes and promoting enlightened values drew parallels between Europe's progress and the perceived barbarism of 19th-century Argentina. During his presidency from 1868 to 1874, he advocated for education, democracy, and modernization, spearheading initiatives to develop train systems, a postal network, and an extensive education system. Sarmiento's contributions as a political innovator and esteemed writer earned him recognition and respect, with figures like Miguel de Unamuno regarding him as one of the finest Castilian prose writers. His legacy endures as a champion of progress and education.",Argentina,1868,yes,,,
1st National Census is conducted,"The first national census was conducted in Argentina in 1869. Organized by Superintendent Diego de la Fuente under President Domingo F. Sarmiento, the census aimed to determine the country's position in the civilized world. The actual population was reported as 1,830,214 inhabitants, showing significant demographic growth similar to the United States. Foreigners, particularly Europeans, accounted for 12 percent of the population, mainly concentrated in provinces such as Buenos Aires. The census revealed high rates of illiteracy, with 65 percent of men and 78 percent of women aged 14 and above being illiterate.",Argentina,1869,no,,,
End of the War of the Triple Alliance (1865-1870),"The Paraguayan War, also known as the War of the Triple Alliance, ended with the death of Marshal Francisco Solano López, marking a significant conflict in South American history. Paraguay, now in need of reconstruction, has been compelled to accept the terms of the Treaty of the Triple Alliance signed by Argentina, Brazil, and Uruguay. The treaty stipulated the deposition of President López and territorial concessions to Argentina and Brazil. Paraguay's sovereignty over its rivers is lost, and it is burdened with the responsibility of repaying the war debt. The war was fueled by issues of boundaries, navigation, foreign interests, and the expansion of capitalism, with Paraguay maintaining an autonomous development policy. The conflict witnessed heroic battles and events, and despite the occupation of Asunción, López continued to resist, rallying a sizeable but ill-equipped army. The war faced opposition within Argentina, and international voices protested the treaty's terms. The outcomes of the war entailed Paraguay's acceptance of defeat, territorial losses, economic burden, and the need for reconstruction.",Argentina,1870,no,,,
Yellow Fever Epidemic,"Between January and March of 1871, Buenos Aires faced a devastating yellow fever epidemic that affected the city's population. The outbreak started in San Telmo and quickly spread throughout the city, causing panic among the residents. Approximately 10% of the population, which amounted to about 18,000 people, lost their lives to the disease. The epidemic led to a mass exodus of people fleeing death, only to return to find their homes empty or looted. Despite efforts to declare calm and implement measures such as quarantines, the weekly death toll remained high, with 400 to 500 people succumbing to the fever. In the midst of the epidemic, efforts began to improve the city's infrastructure, including the implementation of sewerage, drainage, and clean drinking water projects, which had been neglected until then.",Argentina,1871,no,,,
Creation of the National Territory of Gran Chaco,"On January 31, 1872, President Domingo Faustino Sarmiento issued a decree to establish the National Territory of the Gran Chaco, which had its capital in Villa Occidental. The decree appointed Julio de Vedia, commander of the Argentine forces stationed in Asunción, as the governor. The National Congress later ratified the decree in October of the same year through the enactment of Law 576. Although the exact boundaries of the territory were not specified in the decree or the law, it extended from the Salado River in the south to the Río Verde in the north. However, the western limits were not defined.",Argentina,1872,no,,,
Assassination Attempt on President Sarmiento: A Miraculous Escape,"On the night of August 28, 1873, Domingo Faustino Sarmiento, the President of Argentina, survived an assassination attempt. While crossing the intersection of Maipú and Corrientes streets in Buenos Aires, three individuals fired a blunderbuss at him from close range. However, one of the blunderbusses exploded in the hands of the shooter due to an excessive charge. The attackers, Francisco and Pedro Guerri, along with Luis Casimiro, were apprehended by the police. It was revealed that they had been hired by Aquiles Seabrugo, an agent of Carlos Querencio, who was connected to López Jordán. The Guerri brothers were promised a sum of 10,000 pesos for carrying out the attack. They had planned to escape to Montevideo via a boat in the port. In Buenos Aires, the trial of the Guerri brothers took place, while in Montevideo, Seabrugo was assassinated by Querencio. The motive behind the attack remained a mystery for a long time. This assassination attempt was significant as it was the first open and direct attempt on the life of an Argentine president.",Argentina,1873,no,,,
1874-1880: Presidency of Nicolás Avellaneda.,"Nicolás Avellaneda was elected as the third president of Argentina in 1874, defeating Bartolomé Mitre. He shared the foundational goals of the Argentine state, focusing on the nation, constitution, and freedom. Avellaneda was the first civilian president and opposed the autonomy aspirations of Buenos Aires. During his presidency, Argentina did not intervene in the War of the Pacific between Chile and Bolivia. The Avellaneda presidency faced economic challenges, including a budget deficit and financial mismanagement, which led to measures such as increased import duties and reduction in public spending. The economic crisis was partially resolved by an increase in wool prices and the promotion of immigration through the Avellaneda Law. The president also supported agricultural expansion, railway development, and the introduction of refrigerated shipping, which transformed Argentine exports.",Argentina,1874,yes,,,
PAN: Argentina's Dominant Political Party and the Agro-Export Model,"The PAN (National Autonomist Party) was a conservative liberal political party in Argentina that held significant influence from 1874 to 1916. It was formed on March 15, 1874, through the merger of the Autonomist parties led by Adolfo Alsina and Nicolás Avellaneda. The prominent figure within the party was Julio Argentino Roca, who served as president twice. The PAN represented the upper class of Buenos Aires and exerted a paternalistic leadership style. It maintained its hold on power through electoral fraud, manipulating the voting process. Economically, the party advocated for an agro-export model, which prioritized livestock and cereal production in the fertile pampas region. This approach played a crucial role in the expansion of the Argentine rail network and the implementation of a capitalist system.",Argentina,1874,no,,,
1st La Rural Expo,"La Rural Expo, officially known as the International Livestock, Agriculture and Industry Exhibition, is an annual event held in Buenos Aires, Argentina. It is organized by the Argentine Rural Society and is considered the country's most important agricultural exhibition. The first edition of La Rural Expo took place in 1875. The fairgrounds cover a significant area and feature exhibits of livestock, agriculture, industry, commerce, and agricultural and livestock education. It serves as a meeting point for producers, contractors, businessmen, professionals, students, and technicians from Argentina and around the world.",Argentina,1875,no,,,
Establishment of Argentine Mint (Casa de Moneda),"The Argentine Mint, known as the Casa de Moneda de la República Argentina, is the country's mint and is under the control of the Argentine government, overseen by the Ministry of Economy. It was established in 1875 under the name ""Casa de Moneda de la Nación"" and was responsible for producing the national currency, initially the peso fuerte. The Casa de Moneda operates two mints, one in Buenos Aires and another in Salta. The first coin production facility was opened on February 14, 1881, in Buenos Aires. In addition to coins, the Casa de Moneda produces banknotes, medals, and security prints used by government-run service providers. The official currency printed by the mint is the Argentine peso, which has been in circulation since 1992.",Argentina,1875,no,,,
"The Avellaneda Law of 1876: Land Regulation, Colonization, and Immigration","The Avellaneda Law of 1876 in Argentina regulated land occupation and colonization for nearly sixty years. It authorized various colonization systems, set limits on land parcel sizes, and promoted immigration. However, the law failed to prevent speculation and establish small landowners due to the freedom granted to private colonization companies. It also allowed the transfer of millions of hectares of public land into private hands. The law defined immigrants as foreign laborers, craftsmen, industrialists, farmers, or teachers under sixty years of age, who arrived in Argentina with their own means or with support from the nation, provinces, or private companies, intending to settle in the country.",Argentina,1876,no,,,
Cold Storage Revolution: Argentina's Pioneering Export of Frozen Meat to Europe,"The French company MC Tellier introduced the concept of preserving meat by cold, and their steamship called ""Le Frigorifique"" arrived in Buenos Aires in December 1876 with fresh meat that had been preserved using cold storage techniques. This marked the beginning of Argentina's history as the first country to export refrigerated and frozen meat to Europe. The steamship Paraguay later arrived, further improving the freezing process. The introduction of refrigeration revolutionized the meat industry and had a profound impact on the national economy. ""Le Frigorifique"" was equipped with refrigerated chambers and carried various livestock and poultry cooled to 0°C.",Argentina,1877,no,,,
Conquest of the Desert (1878-1885),"The Conquest of the Desert was a military campaign launched by the Argentine government against indigenous groups, primarily the Mapuche and Tehuelche peoples, in Patagonia. The campaign aimed to establish control over the region and expand Argentina's territory. However, it resulted in the displacement and marginalization of indigenous communities. From a modern perspective, the Conquest of the Desert is seen as a dark chapter in Argentina's history, highlighting the injustices faced by indigenous populations. ",Argentina,1878,yes,,,
Death of Gauchito Gil: A Myth is Born,"Gauchito Gil, the mysterious figure of Antonio Plutarco Cruz Mamerto Gil Núñez, is a beloved religious figure in Argentina. Born in the mid-19th century, little is known about his life, but his story has captivated the hearts of the people. As a rural gaucho, he faced persecution for his forbidden love affair and eventually became a deserter in war. Captured and executed, he asked his executioner to pray for his ailing son, and a miraculous healing occurred. This event led to the construction of a shrine in his honor, where his devotees, predominantly Catholics, seek his intercession and find solace in his story of freedom, martyrdom, and forgiveness. Gauchito Gil's cult is deeply rooted in popular Catholicism, and his significance has been recognized and supported by Pope Francis, embracing the devotion of the people.",Argentina,1878,yes,,,
The 1879 Offensive: Conquest of the Desert and Argentina's Territorial Expansion,"In 1879, a major offensive of the Conquest of the Desert was launched. Five divisions totaling 6,000 men, including indigenous allies, advanced towards the Río Negro. Minister of War Julio Argentino Roca celebrated the capture of Choele Choel Island on May 25. The campaign resulted in the killing and capture of many indigenous people, including prominent caciques (chiefs), and the taking of thousands of women and children as prisoners. As a result of the successful expeditions, Argentina was able to fully incorporate the pampas and Patagonia into its territorial sovereignty. The campaign opened up millions of hectares of land for white settlement, leading to the establishment of towns, ports, farms, and the advancement of communication, transportation, and infrastructure such as roads, posts, and telegraphs.",Argentina,1879,no,,,
The Revolution of 1880,"The Revolution of 1880 is recognized as the final chapter of the civil conflicts in Argentina. This period was defined by the power struggle between President Nicolás Avellaneda and the process of federalizing the territory of Buenos Aires. The events unfolded through violent confrontations that ultimately led to the defeat of the Province of Buenos Aires, the transformation of the city into a federal territory, and the establishment of Julio Argentino Roca's long-lasting dominance in Argentine politics.",Argentina,1880,yes,,,
1880-1886 Julio Argentino Roca’s 1st Presidency,"Roca's presidency, which began in 1880 and lasted until 1886, was characterized by an ambitious agenda of modernization and expansion. His administration focused on promoting economic development, encouraging foreign investment, and implementing infrastructure projects, particularly in transportation and communication. Roca's policies aimed to integrate the vast territories of Argentina, encourage agricultural and industrial growth, and attract European immigrants to populate and develop the country.",Argentina,1880,yes,,,
Boundary Treaty of 1881 between Chile and Argentina,"The Boundary Treaty of 1881 established the border between Argentina and Chile, specifically defining the boundaries of Patagonia. Signed in Santiago, Chile, on July 29, it was negotiated by Francisco de Borja, Chile's Consul General in Buenos Aires, and Bernardo de Irigoyen, Argentina's Minister of Foreign Affairs. The treaty was based on the principle of Uti possidetis iure, which determined that the new states would inherit the borders of the former Spanish colonies.",Argentina,1881,no,,,
Foundation of La Plata - Capital of Buenos Aires Province,"The province of Buenos Aires fulfilled its dream on November 19 as the foundation stone for its capital, La Plata, was laid. After extensive negotiations, a political agreement was reached, and the Lomas de la Ensenada area was chosen for the construction of the city. The vision was to create a unique city meticulously planned, with grand buildings to house the public administration. The debates and discussions surrounding the capitalization of Buenos Aires were significant, with the upper house unanimously approving the transfer while the lower house had memorable controversies. The name ""La Plata"" was chosen for the new capital, and its foundation was marked by the absence of President Julio A. Roca due to his strained relationship with Governor Dardo Rocha. Despite some mishaps during the event, the foundation of La Plata was seen as a momentous occasion, with future aspirations for a flourishing city with well-designed streets and squares.",Argentina,1882,no,,,
1st Mayor of Buenos Aires - Torcuato de Alvear,"Torcuato de Alvear was appointed as the first mayor of Buenos Aires by President Julio Argentino Roca. Alvear initiated several projects to transform the city, including the demolition of the Recova Vieja in Plaza de Mayo and the unification of Victoria and May 25 squares. He faced resistance from residents, but his efforts aimed to improve the central aspect of the city and its infrastructure.",Argentina,1883,no,,,
Common Education Law 1420,"The Law 1420 of General Common Education of Argentina was a landmark national law that dictated public, compulsory, free, and secular education for children between 6 and 14 years old, with a focus on subjects such as reading, writing, mathematics, geography, and history. Religious education was made optional and could be taught outside of regular school hours. It was passed in 1884 during the administration of President Julio Argentino Roca, after a number of similar laws of provincial scope and the conclusions of the Pedagogical Congress of 1882.",Argentina,1884,no,,,
Gold rush in Tierra del Fuego,"From 1883 to 1906, Tierra del Fuego underwent a gold rush that drew numerous individuals from Chile, Argentina, and Europe, including a significant number of Dalmatians. This gold rush resulted in the establishment of the archipelago's initial towns and contributed to the economic prosperity of Punta Arenas. Once the gold rush subsided, the majority of gold miners departed from the archipelago, while the remaining settlers turned to activities such as sheep farming and fishing. Sadly, the indigenous Selk'nam populations experienced a significant decline during this period.",Argentina,1883,no,,,
The Avellaneda Law (1885),"The Avellaneda Law, also known as the National Universities Statutes, was enacted in 1885 in response to the growth of universities in Argentina. It set the guidelines for each university to establish its own statutes, subject to approval by the Executive Power. The law granted universities the exclusive authority to issue professional diplomas and established governing bodies, regulating their method of election and defining their basic responsibilities. The law was repealed in 1947 during Juan Peron’s presidency. Its primary focus was on the administrative organization of universities, while allowing flexibility for universities to make their own decisions in other areas.",Argentina,1885,no,,,
