title,description,country,year,important,keywords,link,image
Invention of Dulce de Leche,"There is a historical document in the National Historical Museum of Argentina that presents one version regarding the invention of dulce de leche around 1829. According to this account, it is said to have occurred during a meeting between Juan Manuel de Rosas and his political rival Juan Lavalle, who were about to sign the Pact of Cañuelas. Lavalle arrived first and, feeling exhausted, laid down on Rosas's cot and fell asleep. Meanwhile, Rosas's maid was boiling milk with sugar, known as ""lechada,"" to serve with mate (a traditional South American infused drink). When the maid discovered Lavalle sleeping on her employer's cot, she considered it disrespectful and informed the guards. Later, Rosas arrived and was not upset with Lavalle. He asked the maid for mate con leche, but she had left the milk with sugar on the stove for too long. Upon returning to fetch it, the maid found a thick substance resembling a brown color. Rosas enjoyed its taste, and it is said that he shared the sweet concoction with Lavalle while they discussed the terms of the pact. It's important to note that this is just one version among several regarding the origin of dulce de leche.",Argentina,1829,no,,,
Unitarian League: A Struggle for Power in 1830 Argentina,"In 1830, amidst the ongoing conflicts between the Unitarians and the Federalists in Argentina, the Unitarian League, also known as the Liga del Interior, emerged under the leadership of José María Paz, the governor of Córdoba province. This league aimed to unite the Unitarian provinces and challenge the dominance of the Federalists, led by Juan Manuel de Rosas. With the goal of establishing a centralized government and promoting Unitarian principles, the league faced significant obstacles, including military defeats and the stronghold of the Federalists in Buenos Aires. Nevertheless, the formation of the Liga del Interior symbolized the persistent struggle for power between the Unitarians and the Federalists, which would continue to shape Argentine politics in the years to come.",Argentina,1830,no,,,
The Federal Pact (1831),"In 1831, as a response to the Unitarian League and under the leadership of Juan Manuel de Rosas, the Litoral League emerged in Argentina. This league was formed as a result of the Federal Pact, a political agreement signed between Buenos Aires, Santa Fe, Entre Rios, and later Corrientes. The Federal Pact aimed to establish a federal system of government and strengthen the power of the provinces in relation to the central government. The formation of the Litoral League represented a significant development in the ongoing struggle for political dominance between the Unitarians and the Federalists in Argentina.",Argentina,1831,no,,,
Juan Ramón Balcarce - New Governor of Buenos Aires,"In 1832, General Juan Ramón Balcarce was elected as the new governor of Buenos Aires, replacing Juan Manuel de Rosas. This marked a transition of power within the province of Buenos Aires, which held significant influence over the rest of Argentina during this period. Juan Manuel de Rosas, who had been in power for several years, organized a military campaign known as the ""Campaign to the Desert"" (Campaña al Desierto). The Campaign to the Desert was a military expedition led by Rosas to subdue and expand control over the indigenous populations in the southern region of Argentina, specifically the Pampas and Patagonia.",Argentina,1832,no,,,
Desert Campaign (1833–34),"Juan Manuel de Rosas, during his early administration, faced challenges such as severe deficits, large public debts, and a drought that impacted the economy. He focused on improving revenue collection, reducing expenditure, and recognizing provincial autonomy in the Federal Pact. By the end of his first term, he was credited with stabilizing the political and financial situation, but faced increased opposition in the House of Representatives. During this period, ranchers began moving into territories in the south inhabited by indigenous peoples, leading to conflicts. Rosas supported the expansion into these territories and granted lands to war veterans and ranchers. He commanded an army to subdue the indigenous tribes in the region, employing a mix of generosity and force. The Desert Campaign, which lasted from 1833 to 1834, resulted in Rosas subjugating the entire region, opening up possibilities for further territorial expansion. Rosas saw the conquered territories as an opportunity for agricultural development and expressed his vision for the future growth of the nation.",Argentina,1833,yes,,,
Revolution of the Restorers,"The Revolution of the Restorers (Spanish: Revolución de los Restauradores) was a rebellion that took place in Buenos Aires in 1833. The governor Juan Ramón Balcarce was ousted from office and replaced by Juan José Viamonte. The rebellion was motivated by actions taken by Balcarce against former governor Juan Manuel de Rosas. Rosas was absent from the city by that time, but the rebellion was supported by his wife Encarnación Ezcurra. It strengthened the political power of Rosas, who would become governor a second time a short time later.",Argentina,1833,no,,,
Manuel Vicente Maza - Interim Governor of Buenos Aires 1834-1835,"In 1834, and after several potential candidates refused to take the government of the Buenos Aires Province, Maza, as president of the legislature, was designated interim governor. In February 1835 he sent Facundo Quiroga as mediator in the conflict between the governors of the provinces of Salta and Tucumán. As Quiroga was assassinated on his way back to Buenos Aires, Maza was forced to resign on March 7; Rosas once again became governor on April 13.",Argentina,1834,no,,,
Rosas Enacts the Customs Law (1835),"In 1835, during his second term as governor (1835-1852), Juan Manuel de Rosas issued the Customs Law in Argentina. This law, known as the Ley de Aduanas, aimed to regulate and control the customs duties and trade within the country. It was a significant policy measure implemented by Rosas to consolidate his power and strengthen the economic stability of Buenos Aires. The Customs Law had far-reaching implications for trade relations and revenue distribution within Argentina during this period.",Argentina,1835,no,,,
"1836 - Buenos Aires population reaches 62,000","By 1836, the city experienced significant population growth, with the number of inhabitants reaching 62,000. This growth can be attributed to various factors, including increased immigration, economic development, and urbanization. Buenos Aires was becoming an important center of trade and commerce, attracting people from different regions and countries. The growing population reflected the city's expanding influence and its emergence as a thriving urban hub in the region.",Argentina,1836,no,,,
Rosas Declares War on the Peruvian-Bolivian Confederation (1837),"In 1837, Juan Manuel de Rosas declared war on the Confederation Peruano-Boliviana after their invasion of the territories of Salta and Jujuy in Argentina. Rosas saw this invasion as a threat to the sovereignty and territorial integrity of Argentina, leading him to take military action. The conflict with the Peruvian-Bolivian Confederation demonstrated Rosas' determination to protect Argentine interests and maintain his authority as a strong leader within the region.",Argentina,1837,no,,,
The Generation of '37 and the Literary Salon (1837),"In 1837, the Generation of '37 emerged in Buenos Aires, Argentina. This group consisted of young intellectuals and former students of the Colegio de Ciencias Morales, who were deeply concerned about the state of the country. They founded the Literary Salon, a gathering that provided a platform for intellectual discussions and debates on various social, political, and cultural issues.",Argentina,1837,no,,,
Echeverría Founds the Young Argentine Generation (1838),"In 1838, Esteban Echeverría, a prominent member, established the Young Argentine Generation with a clear political intention. This generation drew inspiration from the prevailing ideals of Romanticism in Europe, which exalted national sentiment. Under the subsequent political leadership of Urquiza, their influence would be decisive in the following decades, shaping the intellectual and political landscape of Argentina.",Argentina,1838,no,,,
French Blockade of the Port of Buenos Aires and the Rio de la Plata (1838-1840),"From 1838 to 1840, France imposed a blockade on the Port of Buenos Aires and the Rio de la Plata region. This blockade had a significant impact on trade and commerce in the area, disrupting economic activities and causing hardships for the local population. The French blockade was part of the international conflicts and power struggles that affected Argentina during this period.",Argentina,1838,no,,,
The Revolt of Corrientes: A Struggle for Change against Rosas' Rule,"The 1839 revolt in Corrientes Province, also known as the Revolt of the Quebracho, was an armed uprising led by General Juan Lavalle against the government of Argentine dictator Juan Manuel de Rosas. Taking place in northeastern Argentina, the revolt aimed to overthrow Rosas and his centralist regime. Lavalle's forces, supported by local leaders and the population of Corrientes, initially gained ground, but they faced fierce opposition from Rosas' military. Despite early successes, the revolt ultimately failed, and Lavalle was forced to flee to Bolivia. The uprising demonstrated the persistent opposition to Rosas' rule and the desire for political change in Argentina.",Argentina,1839,yes,,,
La Mazorca and the Reign of Terror: Unveiling the Brutality of Argentina's Red October,"La Mazorca, also known as ""The Ear of Corn,"" was a paramilitary organization and shock group loyal to Governor Juan Manuel de Rosas in Argentina during the 1820s and 1830s. Its full name was ""Sociedad Popular Restauradora o Mazorca,"" and it was characterized by its brutality and violence in defense of the Rosas regime. La Mazorca consisted mainly of gauchos and men from the lower classes, recruited to intimidate and suppress political opponents of Rosas. In September 1840, one of the bloodiest episodes associated with La Mazorca occurred. Known as ""Red October"" (Octubre Rojo), a wave of violence erupted in the streets of Buenos Aires. Bands of armed men dressed in red ponchos, allegedly members of La Mazorca, roamed the streets, killing those they deemed as opponents of the Rosas government. Political opponents and their followers were pursued, murdered, and their homes were invaded. The Minister of Government, Felipe Arana, feared being one of the victims. However, after forty days of violence, British Ambassador Henry Mendeville intervened and asked Rosas to halt the killings. Rosas responded with offense and claimed that he would even kill his own daughter if he found her involved with the opposition. However, that same night, the repression ceased. Mendeville, who sympathized with the Rosas regime, did not want to overstate his influence but acknowledged that he only intervened when the most significant events had already taken place. The peace treaty with France had an immediate impact on the country's internal life. From that point on, La Mazorca ceased to appear on the streets.",Argentina,1840,yes,,,
Battle of Famaillá,"The Battle of Famaillá, which took place in 1841 during the Argentine Civil Wars, was a decisive clash between the Unitarios and Federales forces. Led by General Lavalle, the Unitarios sought to challenge the power of the Federalist leader Juan Manuel de Rosas. However, their campaign faced a setback as they encountered the formidable forces of General Pacheco at Famaillá. Despite their initial advancements, Lavalle's troops suffered a defeat, resulting in significant casualties. The battle marked a turning point in the conflict, solidifying Rosas' control and demonstrating the strength of the Federalist faction. The outcome of the Battle of Famaillá had lasting implications for the political landscape of Argentina and the progression of the civil wars.",Argentina,1841,no,,,
Battle of Arroyo Grande (Argentina),"The Battle of Arroyo Grande, which took place on December 6, 1842, in Entre Ríos province, Argentina, was a significant and decisive engagement during the Argentine and Uruguayan civil wars. It pitted the federal army of Buenos Aires and Entre Ríos, led by former Uruguayan president Brigadier Manuel Oribe, against a coalition of Uruguayan Colorados and Argentine Unitarians, including migrants from Buenos Aires, Corrientes, and Santa Fe, under the leadership of Brigadier Fructuoso Rivera. This battle marked the end of a violent civil war in Argentina and marked the beginning of the major conflict known as the Great War in Uruguay.",Argentina,1842,no,,,
Rosas Supports Deposed Uruguayan Leader Manuel Oribe (1843),"In 1843, Juan Manuel de Rosas provided support to his ally Manuel Oribe, who had been overthrown in the Uruguayan government. Rosas initiated a blockade of Montevideo, the capital of Uruguay, in an effort to assist Oribe's return to power. This intervention in Uruguayan affairs demonstrated Rosas' involvement in regional politics and his willingness to assert his influence beyond Argentina's borders.",Argentina,1843,no,,,
1844 Salta earthquake,"The Province of Salta, located in an area of high seismic activity, experienced a major earthquake in October 1844. The 1844 earthquake, measured at VII on the Mercalli intensity scale, affected various villages in Salta and its capital city. While it caused damage and impacted numerous families, no loss of life was reported. The earthquake also affected the neighboring provinces of Jujuy, Tucumán, and Santiago del Estero, causing damage in those areas as well. Following the initial tremor, several aftershocks were felt, and new channels were formed as cracks opened in the ground, allowing water to flow through them. The last aftershock occurred on October 27th.",Argentina,1844,no,,,
Battle of Vuelta de Obligado (1845),"The Battle of Vuelta de Obligado took place in 1845, where the Argentine Confederation suffered a defeat. Despite their loss, the conflict was costly for both England and France, prompting them to negotiate peace through the Arana-Sothern and Arana-Lepredour Treaties. Although Juan Manuel de Rosas had to make concessions in these treaties, it earned him recognition as a staunch defender of national sovereignty. This victory solidified Rosas' power within the Argentine Confederation.",Argentina,1845,no,,,
Anglo-French Blockade against Rosas (1845-1850),"From 1845 to 1850, England and France imposed a joint blockade against Juan Manuel de Rosas and the Argentine Confederation due to Rosas' blockade of the Uruguay River. The Anglo-French blockade aimed to weaken Rosas' regime and exert pressure on Argentina. The blockade had significant economic and political consequences, intensifying the ongoing conflicts and struggles for power in the region.",Argentina,1845,yes,,,
The Battle of Laguna Limpia (1846),"The Battle of Laguna Limpia took place on February 4, 1846, during the Argentine civil wars. The battle occurred in the southwest of the province of Corrientes, Argentina. Justo José de Urquiza, the governor of Entre Ríos, led the federal army, while Juan Madariaga commanded the Army of the Province of Corrientes.",Argentina,1846,no,,,
The Battle of Vences (1847),"The Battle of Vences took place on November 26, 1847, between the federal forces led by Justo José de Urquiza and the province of Corrientes under the command of Joaquín Madariaga. The federal forces achieved a decisive victory, leading to the submission of Corrientes to the authority of the Buenos Aires governor, Juan Manuel de Rosas. The battle marked the end of Corrientes' rebellion against Buenos Aires and its struggle for free navigation of the rivers and customs autonomy. It resulted in the reinstatement of federal political formulas in Corrientes and its full integration into the Argentine Confederation.",Argentina,1847,no,,,
Rosas Moves to Palermo ,"Rosas moves to his new residence, known as Palermo de San Benito or Palermo of Saint Benedict, located in the area of ""Bañado de Palermo"" in Buenos Aires. Rosas began building the mansion and its surrounding features, including an artificial pond, canal, and landscaped areas, between 1836 and 1838. Completed around 1848, the residence became Rosas' permanent home. The mansion was the largest in Buenos Aires at that time. However, with Rosas' exile, the residence was eventually abandoned and demolished in 1899.",Argentina,1848,no,,,
The Arana-Southern Treaty: Resolving Conflicts between Argentina and the United Kingdom,"The Arana-Southern Treaty, signed on November 24, 1849, aimed to restore friendly relations between the Argentine Confederation and the United Kingdom. In the late 1840s, Argentina's efforts to regulate river traffic on the Paraná and Uruguay rivers disrupted Anglo-French trade in Paraguay, leading to a blockade of the Río de la Plata. Despite the blockade's failure to force Juan Manuel de Rosas to surrender, negotiations for peace treaties ensued. The Arana-Southern Treaty granted Argentina full sovereignty over its interior rivers, including the Uruguay River, and allowed Argentina to settle disputes with Uruguay without foreign intervention. Additionally, the treaty resulted in the return of captured ships and Martín García Island to Argentina, with the British fleet acknowledging Argentina's flag. This treaty marked a significant triumph for Rosas, showcasing the ability of emerging South American nations to assert their independence against European powers. After ratification on May 15, 1850, the details of the treaty were documented in the archives of the UK Foreign and Commonwealth Office.",Argentina,1849,yes,,,
Death of San Martin,"On August 17, José de San Martín, the liberator of three countries (Argentina, Chile, and Peru), passed away in France in poverty and obscurity. Despite living a seemingly content life in France, San Martín expressed a longing for his homeland and felt a void even in his happiness. He had been living in Europe due to difficult economic circumstances and lack of support from the Argentine and South American governments. His body was eventually transferred to Buenos Aires according to his last will.",Argentina,1850,no,,,
Pronouncement of Urquiza,"Urquiza's pronouncement was a proclamation made by General Justo José de Urquiza on May 1, 1851, in Concepción del Uruguay, Argentina. At the time, Juan Manuel de Rosas held significant power as the governor of the Province of Buenos Aires and controlled foreign relations in the Argentine Confederation. Juan Manuel de Rosas would submit his resignation from office every year, fully aware that it would be rejected. This seemingly peculiar practice was employed by Rosas as a political strategy to maintain his hold on power and control over the provinces of the Argentine Confederation. Urquiza's pronouncement accepted Rosas's resignation on behalf of the Province of Entre Ríos, allowing it to resume its trade and foreign relations until the establishment of a formal republic. Urquiza's pronouncement gained support from the governor of Corrientes, Benjamin Virasoro, but Rosas refused to accept it and remained in office. This led to open hostility between the provinces, and Entre Ríos and Corrientes formed the Ejército Grande with the assistance of Uruguay and the Empire of Brazil. The following year, the Battle of Caseros took place, resulting in Rosas's defeat.",Argentina,1851,no,,,
The Battle of Caseros,"The Battle of Caseros took place on February 3, 1852 near the town of El Palomar, Buenos Aires Province, and resulted in the defeat of the Argentine Confederation, led by Juan Manuel de Rosas, by the Ejército Grande, a coalition of forces from Brazil, Uruguay, and various Argentine provinces. The battle led to Rosas's resignation from government and his subsequent exile in the United Kingdom.",Argentina,1852,yes,,,
Argentine Constitution of 1853,"The Argentine Constitution of 1853 laid the legal foundations for the Argentine Republic. It was approved by representatives of most provinces, except Buenos Aires, and was modeled after the United States Constitution, emphasizing republican principles, federalism, and a division of powers. The constitution has been subject to criticism for its effectiveness in implementing a foreign model in a unique Argentine context. It remained in force until 1930, interrupted by coup d'états, and has been fully in effect since 1983, with subsequent reforms. The original document is preserved in the Palace of Congress.",Argentina,1853,yes,,,
1854-1860 - Presidency of Justo Jose de Urquiza (1st President under Constitution of 1853),"Justo José de Urquiza became president, establishing the capital in Entre Ríos. Buenos Aires had seceded from the Confederation in 1852 and remained an independent state during Urquiza's presidency. Urquiza aimed to strengthen national unity, organized elections, and established the National Congress. He focused on creating a national army, modernizing communications, and promoting agricultural colonies. However, the Confederation faced economic challenges, including a lack of resources and dependence on Buenos Aires. Efforts to establish a banking system failed, and measures to weaken Buenos Aires' dominance did not yield significant results. Urquiza believed that incorporating Buenos Aires was crucial for overcoming economic difficulties.",Argentina,1854,no,,,
Introduction of Railways (1855 onwards),"The expansion of the railway network in Argentina during the 19th century had a transformative effect on the country. It facilitated the transportation of goods, opened up new areas for settlement and agriculture, and stimulated economic growth. The development of the railway system played a crucial role in Argentina's rise as a major agricultural and industrial power. Today, railways continue to be an important mode of transportation and contribute to Argentina's economic development.",Argentina,1855,no,,,
The Law of Differential Rights,"The Law of Differential Rights, enacted in 1856 during Urquiza's presidency, aimed to address the economic disparities between Buenos Aires and the Confederation. The law imposed higher import duties on foreign goods entering the Confederation through Buenos Aires compared to those entering directly through other ports. It also established differential export duties. However, these measures did not significantly impact Buenos Aires' economic dominance, and the Confederation continued to face economic challenges, eventually leading Urquiza to prioritize the reunification of Buenos Aires with the Confederation.",Argentina,1856,no,,,
Valentín Alsina's Aggressive Policies,"During Valentín Alsina's governorship, which began in 1857, the Buenos Aires government pursued an assertive policy, rejecting the Differential Rights Law and disregarding peace treaties. In an effort to weaken the Confederation, Alsina supported movements in the provinces that aimed to unify under his leadership. The press in Buenos Aires became increasingly hostile, fueling calls for war against the Confederation or complete independence. This period saw frequent revolutions in the interior provinces, with Santiago del Estero and Corrientes being relatively stable and more aligned with Buenos Aires' politics rather than Urquiza's.",Argentina,1857,no,,,
"Afro-Argentine Organizational Efforts and the Rise and Fall of ""El Proletario"" Newspaper","In Argentina, Afro-Argentines organized into groups and associations, such as the ""cofradías,"" to preserve their customs and advocate for their rights. Over time, these collectives evolved into novel entities with mutualistic objectives, addressing racial discrimination, economic disparities, and social inequality. In 1858, ""El Proletario"" newspaper emerged as a pioneering publication, amplifying the struggles of Afro-Argentines and the working class, becoming one of the first newspapers to do so. However, financial challenges hampered the sustainability of ""El Proletario,"" leading to its eventual closure. Despite its demise, the organizational efforts and the emergence of the newspaper laid the groundwork for future movements and organizations that continue to fight for the rights and recognition of Afro-Argentines in Argentina.",Argentina,1858,no,,,
Pact of San José de Flores (Buenos Aires becomes part of Argentina again),"The Pact of San José de Flores, signed on November 11, 1859, between the Argentine Confederation and the State of Buenos Aires, marked a significant moment in Argentine history. Following the Battle of Cepeda, which had divided the country, the pact aimed to establish guidelines for Buenos Aires' entry into the Confederation and its acceptance of the Argentine Constitution of 1853. The Buenos Aires Customs issue, the control of foreign embassies, and political alliances had fueled tensions between the Confederation and Buenos Aires. General Bartolomé Mitre's defeat in the Battle of Cepeda led to negotiations, and the pact was eventually signed in the village of San José de Flores. The treaty declared Buenos Aires as part of the Confederation, called for a provincial convention to propose amendments to the Constitution, and preserved the unity of Buenos Aires. The pact played a role in subsequent political events, ultimately leading to the abrogation of the agreement and renewed civil war. Bartolomé Mitre emerged victorious and became the first president of the reunited Argentine Republic in 1862.",Argentina,1859,yes,,,
