title,description,country,year,important,keywords,link,image
Establishment of the School of Medicine in Argentina (1800),"In 1800, the School of Medicine was founded in Argentina, marking a significant milestone in the country's educational and healthcare landscape. The school commenced its activities the following year, offering courses in medical sciences, as well as chemistry with texts by Lavoisier, and botany. This establishment provided structured medical education, training aspiring physicians, and emphasized the importance of scientific knowledge in the medical field. The School of Medicine served as a foundation for the growth of medical expertise and contributed to advancements in healthcare practices in Argentina.",Argentina,1800,no,,,
Portuguese Invasion of Rio de la Plata (1801),"In 1801, Portugal launched a brief invasion of the Rio de la Plata region, then under Spanish control. This expansionist endeavor aimed to regain territories previously awarded to Spain. Portuguese forces occupied towns and forts, including the Eastern Missions. However, the conflict was swiftly resolved through the signing of the Treaty of Badajoz, which returned the occupied territories to Spanish control.",Argentina,1801,no,,,
Telégrafo Mercantil: A Pioneering Newspaper Shaping Buenos Aires' History,"Telégrafo Mercantil, also known as El Telégrafo Mercantil, was a prominent newspaper published in Buenos Aires, Argentina, during the 19th century. Founded in 1801 by Francisco Cabello y Mesa, it is considered one of the oldest and most influential newspapers in the country's history. Telégrafo Mercantil played a crucial role in disseminating news, opinions, and commercial information to the public, particularly focusing on trade, finance, and economic affairs. It served as a vital source of information for merchants, businessmen, and the general population, shaping public discourse and contributing to the cultural and intellectual development of Buenos Aires during that era.",Argentina,1801,no,,,
Conflict in Upper Paraguay (1802),"In 1802, hostilities erupted in Upper Paraguay, Rio de la Plata, as Portuguese and Spanish forces clashed. The Fort of Coimbra faced a ten-day siege by a Paraguayan expedition led by Governor Lázaro de Ribera, but the small Portuguese garrison, aided by civilians, valiantly defended the fort and repelled multiple Spanish attacks. In retaliation, Portuguese forces under Francisco Rodrigues do Prado launched a successful campaign, destroying the San José fort defended by Captain Juan Caballero. These events heightened tensions and territorial disputes, foreshadowing future conflicts like the War of the Triple Alliance. The events of 1802 in Upper Paraguay underscore the region's turbulent dynamics and the struggle for control between Portuguese and Spanish powers.",Argentina,1802,no,,,
Construction of La Recova de Buenos Aires,"La Recova de Buenos Aires, the first commercial gallery in the city, stood as a dividing landmark between Plaza de la Victoria and Plaza de Armas (later known as Plaza 25 de Mayo) from 1810. Its construction commenced in 1802, and for over 80 years, it served as a bustling marketplace where vendors rented stalls from the Cabildo to sell a wide range of goods to the city's residents. From clothing to meat, milk to frames, candles to bazaar items, La Recova facilitated the exchange of various merchandise, leaving an indelible mark on the commercial history of Buenos Aires. Despite its demolition in 1884, its legacy lives on, as it represents a pivotal hub of commerce and trade in the city's vibrant past.",Argentina,1803,no,,,
Rafael de Sobremonte becomes Viceroy of Rio de la Plata (1804–1807),"Rafael de Sobremonte assumed the role of Viceroy of the Río de la Plata in April 1804, succeeding Joaquín del Pino. During his time in power, he faced the imminent threat of a British attack on Buenos Aires, as Great Britain and Spain were at war. Despite requesting assistance from the Spanish Courts, Sobremonte received no significant help.",Argentina,1804,no,,,
Battle of Trafalgar (1805),"The British victory in the Battle of Trafalgar, fought in 1805 between the British Royal Navy and the combined French and Spanish fleets, had significant implications for the Viceroyalty of Rio de la Plata, which encompassed present-day Argentina, Uruguay, Paraguay, and parts of Bolivia and Brazil. The defeat of the Spanish and French fleets by the British Navy ensured British naval supremacy in the region and severely limited Spain's ability to reinforce or support its colonies. As a result, the Viceroyalty of Rio de la Plata became more vulnerable to British naval blockades and attacks, leading to economic disruptions and increased British influence in the region. The battle effectively weakened Spanish control over its American colonies and contributed to the broader context of independence movements in South America.",Argentina,1805,no,,,
British Invasion of 1806: Argentina's Resilience and Liberation from Occupation,"In 1806, the British Empire targeted Buenos Aires, a Spanish colony in the Viceroyalty of the Río de la Plata, to expand their influence in the Americas. With 1,500 troops, including local supporters, they swiftly captured key positions and took control of the city. However, the occupation was short-lived as the local population, led by Santiago de Liniers, launched a resistance movement. In the Second Battle of Buenos Aires on August 12, 1806, the locals overwhelmed the British garrison, leading to their surrender and the liberation of Buenos Aires. This failed invasion fueled the drive for independence in Argentina and set the stage for the May Revolution of 1810, ultimately resulting in Argentina's independence from Spain.",Argentina,1806,yes,,,
British Invasion of 1807,"In the 1807 British Invasion of the Viceroyalty of the Río de la Plata, the Argentine people faced a renewed assault on their land. With a larger British force, the invaders pushed towards Buenos Aires, but encountered fierce resistance from the local population led by Santiago de Liniers. In the Battle of Buenos Aires, the Argentines fought tenaciously, inflicting heavy casualties on the British forces. Ultimately, the invaders were overwhelmed, leading to their surrender and expulsion from the viceroyalty. This resounding victory further fueled Argentina's resolve for independence, solidifying their path towards self-determination.",Argentina,1807,yes,,,
Appointment of Cisneros as Viceroy of the Viceroyalty of the Río de la Plata (1808),"In 1808, amidst the political upheaval caused by the French invasion, the Central Junta of Seville was established in Spain. This event had significant implications for the Viceroyalty of the Río de la Plata, which encompassed present-day Argentina. The Central Junta appointed Cisneros as the new Viceroy, replacing Santiago de Liniers, thereby introducing changes in governance within the viceroyalty. This marked a pivotal moment in the political landscape of Argentina, as the authority of the Viceroy was now derived from the Central Junta in Seville.",Argentina,1808,no,,,
Ferdinand VII's Deposition in 1808,"Ferdinand VII, the King of Spain, was dethroned on March 19, 1808, amidst the chaos of the Napoleonic invasion of Spain. This significant event marked a turning point in Spanish history, leading to a series of power struggles, political upheavals, and changes in governance. Ferdinand's deposition initiated the Peninsular War, a protracted conflict between the Spanish forces and the French army under Napoleon's command. The dethronement of Ferdinand VII set in motion a period of uncertainty and instability in Spain, shaping the course of political developments and influencing the struggles for independence in various Spanish colonies, including Argentina.",Argentina,1808,no,,,
Opening of Buenos Aires Port to Foreign Trade (1809),"In 1809, Viceroy Cisneros implemented the ""Reglamento de Libre Comercio,"" a provisional regulation that allowed foreign trade in the port of Buenos Aires. This policy shift opened up opportunities for international commerce and marked a departure from the previously restrictive trade policies imposed by Spain. The opening of the port facilitated economic growth, increased access to global markets, and laid the foundation for future trade reforms in Argentina.",Argentina,1809,no,,,
"May Revolution (May 25, 1810)","The May Revolution in Buenos Aires, which took place on May 25, 1810, established the Primera Junta (First Junta) and marked the beginning of Argentina's struggle for independence. The Primera Junta served as the first autonomous government body in Argentina and played a pivotal role in guiding the nation towards self-governance and eventual independence in 1816.",Argentina,1810,yes,,,
Argentine War of Independence (1810-1818),"The Argentine War of Independence (1810-1818) was a series of conflicts fought in the Viceroyalty of the Río de la Plata against Spanish colonial rule. Sparked by the May Revolution of 1810, it saw leaders like José de San Martín and Manuel Belgrano leading armies against Spanish royalists. The war culminated in Argentina's declaration of independence in 1816, marking a significant milestone in the country's liberation from Spanish control and the beginning of a new era of self-governance.",Argentina,1810,yes,,,
First Triumvirate (1811-1812): Argentina's Path to Self-Governance and Independence,"The First Triumvirate in the Viceroyalty of the Río de la Plata was formed on September 23, 1811, and lasted until October 8, 1812. It was a governing body consisting of three members: Feliciano Chiclana, Manuel de Sarratea, and Juan José Paso. The First Triumvirate played a significant role in the early stages of Argentina's struggle for independence and in shaping the political landscape of the region.",Argentina,1811,no,,,
1812-1814: The Second Triumvirate,"The Second Triumvirate, serving from 1812 to 1814, played a crucial role in Argentina's path towards independence. Comprised of notable figures such as Juan José Paso, Nicolás Rodríguez Peña, and Antonio Álvarez Jonte, the Triumvirate served as a provisional government during a turbulent period of the Argentine War of Independence. Faced with internal divisions and external challenges, the Second Triumvirate worked to consolidate revolutionary efforts and maintain stability. Though its tenure was relatively short, the decisions made during this time contributed to the ultimate victory for independence and laid the foundation for Argentina's future as a sovereign nation.",Argentina,1812,no,,,
1812: San Martín's Return to Argentina Ignites the Flame of Independence,"José de San Martín returned to Argentina in 1812, after his time in Spain, bringing with him invaluable military experience and an unwavering commitment to the cause of independence. His arrival proved to be a transformative catalyst, breathing new life into the revolutionary movement and propelling Argentina forward on its path to liberation. Through his exceptional leadership, San Martín played a pivotal role in galvanizing the fight for independence in Argentina.",Argentina,1812,no,,,
"Revolution of October 8, 1812: Paving the Way for Argentine Independence","The Revolution of October 8, 1812 (Spanish: Revolución del 8 de octubre de 1812) took place during the Argentine War of Independence. Led by José de San Martín and Carlos María de Alvear, it deposed the First Triumvirate and allowed the creation of the Second Triumvirate, which called the Assembly of Year XIII.",Argentina,1812,no,,,
Invention of the Flag of Argentina,"The Flag of Argentina, also known as the ""Flag of the Sun,"" was created by General Manuel Belgrano during the Argentine War of Independence. On February 27, 1812, Belgrano designed and raised the flag for the first time. It features three horizontal stripes of light blue and white, representing the clear skies and purity of ideals. At its center is the radiant Sun of May emblem, symbolizing the nation's newfound independence and hope. The flag quickly became a powerful national symbol, representing the unity, pride, and aspirations of the Argentine people.",Argentina,1812,no,,,
Assembly of the Year XIII,"The Assembly of the Year XIII, also known as the Asamblea del Año XIII, was a significant political event that took place in Argentina during the early years of its struggle for independence. Convened on January 31, 1813, in Buenos Aires, the assembly aimed to address critical issues facing the region and establish a framework for governance. Comprised of representatives from different provinces, the assembly debated and passed important resolutions, including the abolition of slavery, the promotion of education, the adoption of a national flag, and the establishment of a national anthem. These measures marked important milestones in Argentina's journey towards independence and the shaping of its national identity. The Assembly of the Year XIII played a pivotal role in laying the foundations for the future development of Argentina as a sovereign nation.",Argentina,1813,no,,,
King Ferdinand's Return: Impact on Argentina's Political Landscape (1814),"The year 1814 in Argentina witnessed the significant return of Ferdinand VII to the throne in Spain, which had a profound impact on the country's political landscape. Ferdinand's reinstatement ignited a complex set of reactions and divisions within Argentina's society. Some embraced his return, seeing it as an opportunity for stability and loyalty to the Spanish monarchy. Meanwhile, others viewed it as a setback to their aspirations for independence and self-governance. The conflicting loyalties and diverging political ideologies set the stage for intense debates and power struggles that would shape Argentina's path towards independence in the following years.",Argentina,1814,no,,,
Argentina's Crisis of 1815,"The year 1815 in Argentina was marked by internal strife, political fragmentation, and a quest for regional autonomy. The country faced economic challenges, witnessed revolts against Buenos Aires' authority, and saw the emergence of provincial proto-states. Despite these difficulties, the determination for independence persisted, ultimately leading Argentina closer to its goal of nationhood.  The events of 1815 set the stage for the Congress of Tucumán, which would take place the following year. This congress brought together representatives from different provinces to officially declare independence from Spain and establish Argentina as a sovereign nation.",Argentina,1815,no,,,
"Argentine Declaration of Independence (July 9, 1816)","On this day, the Congress of Tucumán officially declared Argentina's independence from Spain (In reality, the congressmen who were assembled in Tucumán declared the independence of the United Provinces of South America, which is one of the official names of the Argentine Republic). This event solidified Argentina's sovereignty and laid the foundation for the development of a new nation. It remains a pivotal moment in Argentine history and is commemorated as Argentina's Independence Day. ",Argentina,1816,yes,,,
Congress of Tucumán,"The Congress of Tucumán was a sovereign assembly that at the same time served as a court, legislative and constituent power . It was called by an agreement established in the Statute of 1815 and held sessions in two different places: from March 24, 1816 to January 16, 1817, it did so in the city of San Miguel de Tucumán , and later in the city of Buenos Aires. , between May 12, 1817 and February 11, 1820.",Argentina,1816,yes,,,
Portuguese conquest of the Banda Oriental,"The Portuguese conquest of the Banda Oriental was the armed-conflict that took place between 1816 and 1820 in the Banda Oriental, for control of what today comprises the whole of the Republic of Uruguay, the northern part of the Argentine Mesopotamia and southern Brazil. The four-year armed-conflict resulted in the annexation of the Banda Oriental into the United Kingdom of Portugal, Brazil and the Algarves as the Brazilian province of Cisplatina.",Argentina,1816,no,,,
1817: Battle of Chacabuco - Decisive Triumph for Chilean Independence,"In 1817, José de San Martín's forces achieved a resounding victory over the Spanish royalist army in the Battle of Chacabuco (present-day Chile). This triumph secured Chile's liberation from Spanish control and established San Martín as a formidable military strategist and leader.",Argentina,1817,no,,,
1817: Crossing of the Andes - Defying Nature's Obstacles for Freedom,"In 1817, San Martín led his army in the daring Crossing of the Andes, traversing treacherous mountainous terrain to reach Chile. This audacious feat showcased San Martín's military acumen and contributed significantly to the liberation of Chile from Spanish rule.",Argentina,1817,no,,,
1818: Battle of Maipú,"San Martín's forces achieved a decisive victory over Spanish royalist forces in Chile, solidifying Chilean independence.",Argentina,1818,no,,,
1819-1822: San Martín's Plan for Peru,"San Martín formulated a plan to liberate Peru from Spanish control, which included strategic preparations and campaigns. ",Argentina,1819,no,,,
Argentine Constitution of 1819,"The Argentine Constitution of 1819 was a Constitution drafted by the Congress of Tucumán in 1819, shortly after the Argentine War of Independence. It was promoted by Buenos Aires but rejected by the other provinces and did not come into force.",Argentina,1819,yes,,,
Anarchy of the Year XX in Argentina,"The Anarchy of the Year XX, spanning from 1819 to 1820, was a tumultuous period in Argentina characterized by political instability and a lack of centralized governance. It was marked by a power vacuum that led to social unrest, regional rivalries, and frequent changes in leadership. With no strong central authority, Argentina faced a fragmented political landscape, as various provinces and factions competed for power. This period of anarchy was a significant challenge for Argentina's aspirations of establishing a unified and stable government, and it remains an important chapter in the country's history.",Argentina,1820,no,,,
Battle of Cepeda (1820),"The Battle of Cepeda was a significant military confrontation that took place on February 1-2, 1820, near the town of Cepeda in Argentina. It marked a pivotal moment in Argentine history and the culmination of the ongoing power struggle between centralist and federalist factions following the country's declaration of independence. The battle resulted in a decisive victory for the federalist forces led by caudillos Estanislao López and Francisco Ramírez over the centralist army commanded by José Rondeau. The outcome of the battle led to the collapse of the centralist government and the establishment of a federal system in Argentina, setting the stage for subsequent political developments and shaping the country's future path.",Argentina,1820,no,,,
Founding of the University of Buenos Aires: A Milestone in Education,"The founding of the University of Buenos Aires (UBA) on August 12, 1821 marked a significant milestone in the realm of education. This esteemed institution, located in the heart of Buenos Aires, has since become a pillar of academic excellence in Argentina and Latin America. Explore the historical significance of UBA's establishment, which laid the foundation for generations of students to pursue higher education, engage in groundbreaking research, and shape the intellectual landscape of the nation.",Argentina,1821,no,,,
"Construction of the Buenos Aires Metropolitan Cathedral (April 16, 1822)","The construction of the Buenos Aires Metropolitan Cathedral began in 1752 and was completed in 1822. The cathedral serves as an important religious and cultural landmark in Argentina, reflecting the country's historical ties to Catholicism. Today, it stands as an iconic symbol of Argentina's heritage and architectural prowess.",Argentina,1822,no,,,
Revolution of the Apostolics,"In 1822, Bernardino Rivadavia, the minister of the province of Buenos Aires, implemented a series of reformist decrees known as the Law of Ecclesiastical Reform. These reforms mainly targeted religious orders, leading to the closure of several convents and the seizure of their assets. The law abolished tithes and imposed regulations on the number of religious members in each convent. On March 19, 1823, a revolt known as the Revolution of the Apostolics erupted in response to these reforms. Led by Gregorio García de Tagle, the revolt aimed to defend the assets of the Catholic Church in Argentina. The rebels, including notable individuals such as Domingo Achega and Mariano Benito Rolón, attacked the fort but were ultimately dispersed by government forces. Many of the revolt's leaders were captured, executed, or subjected to severe punishments.",Argentina,1823,no,,,
1824: Battle of Ayacucho,"A decisive battle in Peru where the combined forces of Argentina, Peru, and other South American nations defeated the Spanish, effectively ending Spanish colonial rule in South America.",Argentina,1824,no,,,
The General Congress of 1824: Shaping Argentina's Constitution,"In 1824, the General Congress of the United Provinces of the Río de la Plata was convened with the aim of drafting a constitution for the newly formed nation. The congress brought together representatives from various political factions, including the unitarios and federales. However, their differing ideologies and interests created challenges during the constitution-making process.",Argentina,1824,yes,,,
Argentina-Brazil War 1825-1828,"The Cisplatine War, also known as the Argentine-Brazilian War or, in Argentine and Uruguayan historiography, as the Brazil War, or the Liberating Crusade in Uruguay, was an armed conflict in the 1820s between the United Provinces of the Río de la Plata and the Empire of Brazil over Brazil's Cisplatina province, in the aftermath of the United Provinces' and Brazil's independence from Spain and Portugal. It resulted in the independence of Cisplatina as the Oriental Republic of Uruguay.",Argentina,1825,yes,,,
Argentine Constitution of 1826,"The Argentine Constitution of 1826 was a short-lived Constitution of Argentina drafted during the Argentine Civil Wars. Bernardino Rivadavia was appointed President of Argentina under this constitution. It was rejected by most Argentine provinces, and then abolished.",Argentina,1826,no,,,
1st Argentine President - Bernardino Rivadavia,"The presidency of Bernardino Rivadavia in Argentina, which lasted from 1826 to 1827, was a period of significant political and administrative changes. Rivadavia aimed to modernize the country and consolidate power in the national government. His presidency was marked by a series of reforms known as the ""Rivadavian reforms.""",Argentina,1826,yes,,,
Battle of Ituzaingó,"The Battle of Ituzaingó, fought on February 20, 1827, between the Argentine and Brazilian armies, was a significant engagement during the conflicts in the Banda Oriental. Led by General Carlos María de Alvear, the Republican Army successfully repelled the offensive launched by General Felisberto Caldeira Brant, the Marquis of Barbacena. Although the battle did not result in a decisive strategic gain for either side, it marked a tactical victory for the Republicans, preventing Barbacena from advancing towards Buenos Aires. The war continued for another year until a peace treaty was signed in 1828, granting independence to the Brazilian Cisplatina province (Uruguay).",Argentina,1827,no,,,
Decembrist revolution,"The Decembrist revolution, also known as the Revolución decembrina, took place in the Buenos Aires Province, Argentina, in 1828. Juan Lavalle, returning with troops from the Argentine-Brazilian War, staged a coup on December 1, overthrowing Governor Manuel Dorrego and dissolving the legislature. However, Lavalle's actions reignited the Argentine Civil Wars. Rancher Juan Manuel de Rosas organized militias to oppose Lavalle and eventually removed him from power, restoring the legislature. Rosas became the governor of Buenos Aires, leading the fight against the Unitarian League. The conflict ended with the capture of José María Paz, a Unitarian leader who mistakenly thought he was among his own troops. This revolution was part of the broader Argentine Civil Wars, which pitted federalists against unitarians, and it had a significant impact on the political landscape of Argentina.",Argentina,1828,no,,,
1829-1832 - Juan Manuel de Rosas Governor of Buenos Aires,"From 1829 to 1832, Juan Manuel de Rosas served as the governor of Buenos Aires, marking his first term in office. Rosas, a prominent figure in Argentine politics, played a pivotal role in consolidating the Federal Party's power. As governor, Rosas implemented policies that favored the federalist faction and established a strong centralized government in Buenos Aires.",Argentina,1829,no,,,
